source,english_sentence,hindi_sentence
indic2012,"In the scheme of the reading-memorization of the Vedas, listening to the speech of the master and memorizing it plays a very important part in the preservation and success of the Vedas.",वेद के पठन-पाठन के क्रम में गुरुमुख से श्रवण एवं याद करने का वेद के संरक्षण एवं सफलता की दृष्टि से अत्यन्त महत्त्व है।
tides,It is left to the Legislative Assembly of each State to decide whether to recommend to Parliament abolition of the Council where one exists or to seek establishment of one if none exists -LRB- article 169 -RRB- .,"इस प्रश्न का निर्णय हर राज्य की विधान सभा पर छोड़ दिया गया है कि वह चाहे तो संसद से सिफारिश करे कि जहां विधान परिषद है , वहां उसका उत्सादन कर दिया जाए और जहां विधान परिषद नहीं है , वहां उसकी स्थापना कर दी जाए ( अनुच्छेद 169 ) ."
ted,in a very simple way?,सरलता से बनाया जा सके?
tides,"In the movements of the wings are combined the actions of an efficient airfoil , propeller , steering , rudder and brake , all in one .","पंखों की गतियों में एक कुशल वायुपत्रक , नोदक , स्टीयरिंग , दिक्नियंत्रक और ब्रेक की मिलीजुली क्रियाएं शामिल हैं ."
indic2012,.Development is completed on an average by the age of 18-21.,विकास आमतौर पर 18-21 साल की उम्र तक पूरा हो जाता है।
ted,"One is called SOPA, the other is called PIPA.",एक है सोपा (SOPA) और दूसरा है पिपा (PIPA)।
indic2012,highest talked about,सर्वाधिक विचार किया हुआ
tides,The bodies of children under three years are not burned .,तीन वर्ष से कम आयु के बच्चों के शव जलाए नहीं जाते .
tides,The board had agreed to purchase 90 per cent of generated power .,बोर्ड़ ड़ीपीसी की उत्पादित 90 फीसदी बिजली खरीदने पर राजी था .
tides,But they conceive of God as the spirit pervading the universe .,किंतु वे ईश्वर की कल्पना ब्रह्मांड में व्याप्त एक आत्मा के रूप में करते है .
tides,iii Dewany Adawluts or City and Zillah Courts .,सिविल न्यायालय या नगर और जिला न्यायालय ;
ted,And she does it a few thousand times,और वो औरत हजारों हजार बार यही दोहराती है
ted,and I imagine he had nothing more,मेरे ख्याल में उनके पास सिर्फ
ted,"By autumn,",शरद ऋतू के आते
tides,The muscles also begin to lose their weight because of the degeneration of the muscle cells and which are not replaced .,पेशी कोशिकाओं के नष्ट होने और उनकी प्रतिपूर्ति न होने के कारण मांसपेशियों का भार कम होने लगता है .
indic2012,"As per Article 31[1], powers are given to the states to collect their funds by legislating with public interest. If any such law is in violation of article 16 of article 19, it will not be declared unconstitutional or annulled, but it becomes deserving of judicial review. But if it is declared as subject to approval by the President, and has been approved by him, then it will not be requiring judicial review.",1. अनु 31[1] के अनुसार राज्य विधायिका को अधिकार देता है कि वे निजी संपत्ति जनहित हेतु विधि बना कर ग्रहित कर ले परंतु ऐसी कोई विधि असंवैधानिक/रद्द नहीं की जायेगी यदि यह अनु 14 व अनु 19 का उल्लघंन करे परंतु यह न्यायिक पुनरीक्षण का पात्र होगा किंतु यदि इस विधि को राष्ट्रपति की स्वीकृति हेतु रखा गया और उस से स्वीकृति मिली भी हो तो वह न्यायिक पुनरीक्षा का पात्र नहीं होगा
indic2012,You tube video searching format accept and gave to see flash video in online changes June2006 in new upload video H.264 and encoding use.,यू ट्यूब सामान्य विडियो संचिका फॉर्मेट को स्वीकार करता है और उनको फ्लैश video (Flash Video) में उन्हें ऑनलाइन देखने को उपलब्ध करने के लिए बदलता haiजून २००७ से नया अपलोड विडियो भी एच .२६४ (H.264) के एन्कोडिंग का प्रयोग किया है H.264 (H.264)
ted,a lot of what they're talking about.,के हम किस बारे में बात कर रहे हैं.
ted,"people may be economically poor,","कि लोग भले ही रूप से गरीब हों,"
indic2012,{{Hindi computi aarun,{{हिन्दी कम्प्यूटिaarun
tides,China launched a volley of harsh words against India in the UN and other fora .,चीन ने संयुकंत राष्ट्र और अन्य मंचों पर भारत के खिलफ कटु शदों की मुहिम छेड़े दी .
ted,there is no known cause or cure.,जिसका कोई कारण या उपचार नही है.
indic2012,".container ship(container ship),cruise ships(cruise ships),port(port).",समुद्री जहाजो जैसे मालवाहक जहाजो (container ships)या क्रुज जहाजो (cruise ships)से और सम्बन्धित बंदरगाह (port)से होने वाला वायु प्रदुषण.
tides,He narrated in detail the misdeeds of the Britishers in Presidency College .,और फिर उन्होंने प्रेजीडेंसी कालेज में अंग्रेजों के कुकृत्यों का विस्तृत विवरण दिया .
tides,Both Subhas Chandra and Bhagat Ram felt that it was becoming too risky to stay on in the serai .,"सुभाष और भगतराम , दोनों को ही सराय में पड़े रहना अब बहुत खतरनाक लग रहा था ."
ted,what you realize,आप समझ जाते हैं
ted,wherever you need it.,जहाँ भी आप चाहें।
ted,to make books as beautiful as that? (MM: Yes.),ऐसी ही सुंदर पुस्तके बनाने के लिए? (एम एम : हाँ)
ted,He helped me tackle the twin challenges,उन्होंने मुझे सटीक आकार और सरल गति की
indic2012,preliminary life,प्रारंभिक जीवन
tides,It is a large vessel - either of copper or brass - and has to be mounted on a small wooden cart for transportation within the temple precincts .,"यह तांबे या पीतल का बना एक बड़ा बर्तन ढोल ( अवनद्ध-वाद्य ) होता है , जिसे मंदिर में एक से दूसरे स्थान पर ले जाने के लिए लकड़ी की गाड़ी पर चढ़ाना पड़ता है ."
tides,There would be a separate Governor-General for eachDominion who would be appointed by His Majestyand would represent His Majesty for the purposes of the government of the Dominion .,"भारतीय स्वतंत्रता एक्ट के अनुसार , 14-15 अगस्त को भारत तथा पाकिस्तान की दो डोमिनियमों का गठन हो गया ."
tides,Preventive maintenance can save the industry significant loss of output .,रोकथाम की द्Qष्टि से शुरू से रखरखाव करने से उद्योग के उत्पादन में होने वाले बड़े भारी नुकसान को रोका जा सकता है .
ted,"120,000 pounds for Haiti",हैती के लिए १२० हज़ार पौंड जुटाए
tides,"In Punjab , the Unionist Party obtained clear majority .","पंजाब में , यूनियनिस्ट पार्टी को स्पष्ट बहुमत मिला ."
ted,"and people had to walk 20 kilometers, wading in the water -","और लोगों को बीस बीस कि.मी. तक पानी में चल कर जाना पडा था,"
ted,"was like, “You're going to call me a what?”","सोचा कि, “क्या ? क्या कहोगी तुम मुझे ? ”"
indic2012,He also said that he does not bother Raj's comment on him,उन्होंने यह भी कहा था कि वे राज की टिप्पणियों से प्रभावित नहीं है.
ted,People have used this software,लोगो ने इस सॉफ्टवेयर का इस्तेमाल किया है
tides,"But , now the request was turned down with the court pleading that it was not bound to follow any precedent .",लेकिन अदालत ने इस मांग को यह कहकर अस्वीकार कर दिया कि वह किसी पूर्वोदाहरण को मानने के लिए बाध्य नहीं है .
tides,The police are making a hue and cry for no reason since I stand for a non-violent democratic struggle .,मूर्खतापूर्ण बात है.पुलिस बेवजह शोर मचा रही है.मैं तो अहिंसक लकतांत्रिक संघर्ष का पक्षधर हूं .
tides,"You may have seen the TV advertisements featuring children reading a wide range of material in different places , from shopping lists in supermarkets to books on buses or trains .",शायद आपने बच्चे को सुपरमार्केट्स में खरीदी जाने वाली वस्तुओं की तालिकाओं व बस और ट्रेन के विषय में किताबें जैसे विविध प्रकार की वस्तुओं को भिऋ भिऋ क्षत्रों में पढऋते हुए टी वी के वि&आपनों को देखाऋ होगा |भाष्;
indic2012,opt knowledge,सम्यक ज्ञान
ted,We're going to win because the tears that come from our eyes,हम जीतने वाले हैं क्योंकि जो आंसू हमारी आँखों से आते हैं
ted,"whether on the roof of a temple in Singapore,","सिंगापुर में एक मंदिर की छत पर,"
indic2012,. Intimacy :) :) :). Depth of entry :) :) :) :). The dynamics of entry :):) :) :) :),· अंतरंगता (Intimacy) ☻☻☻ · प्रवेश की गहराई ☻☻☻☺ · प्रवेश की गतिशीलता ☻☻☻☻☻
ted,"one with the creator,","परम पिता में,"
tides,” Our food had nothing to do with delicacies .,” हमारे भोजन में स्वादिष्ट व्यंजनों की कोई जगह नहीं थी .
ted,"So, ladies and gentlemen, at TED","देवियों और सज्जनों, TED में"
ted,in an old yearbook,एक पुरानी वर्ष-पुस्तिका से
tides,The summary of our finding is as follows : the overall prevalence is 1.8 per cent .,इस परीक्षण से ज्ञात मधुमेह की व्यापकता समग्र रूप से 1.8 प्रतिशत पायी गयी .
tides,"At the same time , it continued to attach the same weight to traditional industries like cotton textiles in the mill sector , though their relative importance had declined .","इसके साथ ही , इसमें पारंपरिक उद्योगों जैसे मिल में बने सूती कपड़ों को वही महत्व दिया जा रहा है यद्यपि सापेक्षतया उनकी महत्ता अब कम हो गयी है ."
indic2012,Dictionary between Hindi and many other languages,हिन्दी एवं विभिन्न भाषाओं के मध्य शब्दकोष
indic2012,Respect,सम्मान
indic2012,Gandhiji selected the Pattabhi Sitaramaiyya for president post.,गाँधीजी ने अध्यक्षपद के लिए पट्टाभी सितारमैय्या को चुना।
indic2012,Now Humayu had paid attention to it also,अब हुमायूं का ध्यान इस ओर भी गया।
tides,Heading the list is Pranab Mukherjee who is said to have found inspiration after two meetings with former prime minister P.V . Narasimha Rao .,इस सूची में प्रणब मुखर्जी का नाम सबसे ऊपर है.बताते हैं कि पूर्व प्रधानमंत्री नरसिंह राव से दो मुलकातों में उन्होंने उनसे प्रेरणा ली है .
ted,Make it impossible to say,इसे बताना असंभव बना कर
ted,"And then to support the surgeon,",लेकिन इस रफ़्तार पर काम कर रहे चिकित्सक के
indic2012,Islam's golden age began in the rule of Abbasioan,अब्बासियों के राज में इस्लाम का स्वर्ण युग शुरु हुआ।
ted,"The battle is won,","हम युद्ध जीत चुके हैं,"
indic2012,Bhisma lying on the bed of arrows,बाणो की शय्या पर लेटे भीष्म
ted,"we say, “Oh, this is all you.”","हम कहते हैं, ' ओह, ये सब तुम हो. '"
tides,"The breath of spring blows through every line of it , it throbs with the ecstasy of sensuous delight .",इसकी प्रत्येक पंक्ति में जैसे बसंती बयार का झोंका बहता है और ऐंद्रिय उल्लास के उत्कर्ष में बहा ले जाता है .
indic2012,She didn't do much work in painting but still her watercolour works made in the 'Wash' style with vivid colours and delicate lines have become very good examples.,उन्होंने चित्रकला का काम अधिक नहीं किया फिर भी जलरंगों में ‘वॉश' शैली से बनाए गए उनके चित्र धुंधले रंगों और लयपूर्ण रेखाओं का कारण कला के सुंदर नमूने समझे जाते हैं।
ted,Good morning everybody.,सभी को नमस्ते
indic2012,According to Sachin the 13 coins which he had won those days are among the precious assets he has now.,सचिन के अनुसार उस समय उनके द्वारा जीते गये 13 सिक्के आज भी उन्हे सबसे ज्यादा प्रिय हैं।
ted,to a nation that is constantly at the brink of war?,एक ऐसे राष्ट्र को जो लगातार युद्ध की कगार पर रहता है?
ted,"but never learn to swim,","लेकिन, तैरना कभी नहीं सीखते."
ted,My Arabic's reduced by now,मेरा अरबी का ज्ञान अभी
ted,This film also speaks to the Iranian people,ये फ़िल्म ईरानी लोगों से भी कुछ कहती है
indic2012,"But when they saw the last Prophet Nabi (Saleh) in the other community than their own, then they raised a lot of hue and cry.",किन्तु अंतिम नबी ‎‎(सल्ल.) को उन्होंने अपने अतिरिक्त दूसरी क़ौम में देखा तो उत्पात मचा ‎दिया।
tides,"Ramalmga settled the name as ' Thondamandalam ' in an exposition as logical and rigorous as any academician might desiie , and in a manner worthy of an epigraphist .","रामलिंग ने किसी भी तार्किक , खरे विद्वान और पुरालेख-शास्त्री की तरह तोंडमंडलम नाम के पक्ष में अंतिम निर्णय दिया ."
ted,"And for the first time, Africa mattered more to me than ever before.","और पहली बार, अफ्रीका पहले से सबसे ज़्यादा माइने रखने लगा"
ted,"to the real Koranic idea of paradise,","जो क़ुरान में वास्तव में दिए स्वर्ग की कल्पना से बहुत मेल खाता है,"
ted,Of course we wanted to go back to Israel and Palestine.,"निसंदेह, हम फिर से इजराइल तथा फिलिस्तीन जाना चाहते थे।"
ted,"This is a $10,000 machine which was available in Mumbai.","यह 10,000 डालर की मशीन है जो कि मुंबई में उपलब्ध है |"
tides,"The Guru threw the remaining bangle into the water and said , “ There ! ”","गुरु ने दूसरा बचा हुआ कंगन पानी में फेंकते हुए कहा , ? वहां . ?"
ted,and every trick,और हर एक हाँथ की सफाई
indic2012,A knowledgeable person's heart is never fed up with this.,‎ज्ञानवान का दिल इससे कभी नहीं भरता।
indic2012,His sister Kripi was married to Drona.,इनकी बहिन कृपि का विवाह द्रोण से हुआ था।
tides,"In Germany , Switzerland and Sweden , about half of the natural forests are dead or are dying and about 60 per cent of the trees in Britain show signs of decay .","जर्मनी , स्विटजरलैंड और स्वीडन में लगभग आधे प्राकृतिक वन या तो खत्म हो गये हैं अथवा खत्म हो रहे हैं और ब्रिटेन में लगभग 60 प्रतिशत पेड़ सड़-गल रहे हैं ."
indic2012,Bating,बल्लेबाजी
indic2012,in the third part the indian constitution and all its important important rights has been explained in detail.,तीसरे भाग में भारतीय संविधान द्वारा प्रदत्त मौलिक अधिकारों के विषय में विस्तार से बताया गया है।
ted,"and then I say, “Here's a unicycle.”","और कहूँ, “ये है आधा सायकिल सवार!”"
indic2012,"In the Mahabharata, a story comes when the gods of the scale variables in a dice “”Vedas“” and placed second at the “”Indian texts“” to put the “”treatise of India“” has proved to be full of all the scriptures than most, so “”India treatise “”The greatness of the gods and saints by looking at the“” Mahabharata “”named in the story of the men caused the poetic“” Mahabharata “”was the name of the most famous.",महाभारत में एक कथा आती है कि जब देवताओं ने तराजू के एक पासे में चारों वेदों को रखा और दूसरे पर भारत ग्रंथ को रखा तो भारत ग्रंथ सभी वेदों की तुलना में सबसे अधिक भारी सिद्ध हुआ अतः भारत ग्रंथ की इस महता (महानता) को देखकर देवताओं और ऋषियों ने इसे महाभारत नाम दिया और इस कथा के कारण मनुष्यों में भी यह काव्य महाभारत के नाम से सबसे अधिक प्रसिद्ध हुआ।
tides,"As of now , the house languishes in the care-limited to weekly inspections and an occasional clean up-of the Indian Council for Cultural Relations , which has been “ exploring ” options to convert it into a museum or cultural centre .",यह घर भारतीय सांस्कृतिक संबंध परिषद की निगरानी में है.सप्ताह में निरीक्षण और कभीकभार इसकी सफाई कराती है.परिषद इसे संग्रहालय या सांस्कृतिक केंद्र में बदलने के विकल्प की ' तलश ' कर रही है .
indic2012,In that poetry and prose different opinions are developed.,जिसमें गद्य तथा पद्य में अलग अलग विचार धाराओं का विकास हुआ।
ted,AG: Saidulluh Sahib is,अनिल गुप्ता: सैदुल्लासाहिब
indic2012,miracle is said if a man has the qualities apart from the capacity of man,मौअजज़ा उस चमत्कार को कहते हैं जो किसी नबी या ‎रसूल के हाथ पर हो और मानव शक्ति से परे हो जिस पर मानव बुद्धि आश्चर्यचकित हो जाए।
indic2012,"Diwali, Holy, Ide, X-mas, Navratri, Dashara, Durg puja, Mahashivratri, Muharrum etc. are the main festivals.",दिवाली होली ईद क्रिसमस नवरात्रि दशहरा दुर्गा पूजा महाशिवरात्रि मुहर्रम आदि प्रमुख त्यौहार हैं।
indic2012,Translate,अनुवाद
tides,Innocent men are sometimes framed by the police ; and it is small comfort that the same technique is employed to get professional criminals behind the bars upon fabricated charges .,"निर्दोष लोगों को कभी कभी पुलिस झूठे आरोपों में फंसा लेती है , और इसमें कोई खुश होने की बात नहीं कि उसी तकनीक का प्रयोग करके पेशेवर अपराधियों को झूठे आरोपों के आधार पर सींखचों में बंद करा दिया जाता है ."
tides,Direct feeding of the young by the mother is also known .,मां द्वारा तरूण को सीधे ही भरण कराने के उदाहरण भी देखे गए हैं .
tides,"Subhas Chandra , who was closely associated with the Defence Committee , actively assisted in the defence of the prisoners .",सुभाष चन्द्र इन बंदियों की पैरवी समिति से घनिष्ठ रूप से जुड़े हुए Zथे और उन्होंने उनके बचाव में सक्रिय योगदान भी दिया .
