source,english_sentence,hindi_sentence
tides,"They trusted his wisdom , his judgement and his integrity , and they had fastened their hopes on him to give the Muslims a new sense of direction and self-respect .","उन्हें उनकी समझदारी , उनके निर्णय और उनकी ईमानदारी पर विश्वास था और उन्होंने मुसलमानों को नई दिशा का बोध और आत्मसम्मान दिलाने में अपनी आशाएं उनके साथ बांध ली ."
indic2012,Marathi Doordarshan and Marathi TV are also located in Mumbai.,मराठी दूरदर्शन एवं मराठी फिल्म उद्योग भी मुंबई में ही स्थित है।
indic2012,Geetayi- Vinobha bhave,गीताई - विनोबा भावे
ted,Somebody who doesn't care about your achievements.,कोई ऐसा जो आपकी उपलब्धियों के बारे में कोई परवाह नहीं करता
tides,The aristocratic class was on the whole subject to moral restraints but they were not exercised by the state but by public opinion inspired by the religious spirit of the common people .,"यद्यपि संपूर्ण रूप से , कुलीन वर्ग नैतिक प्रतिबंधों के अंतर्गत था , किंतु राज़्य के नियंत्रण द्वारा नहीं , बल्कि आम जनता की धार्मिक भावनाओं से उत्प्रेरित जनमत के द्वारा वे प्रतिबंध क्रियान्वित होते थे ."
tides,"The external walls of these parivara shrines of the malika contain a variety of sculptures , both Saivite and Vaishnavite , of varied iconography , thus making this temple complex a veritable museum of iconography and plastic art .","मालिका के इन परिवार मंदिरों की बाहरी दीवारों पर विभिन्न प्रतिमा विज्ञान की विविध शिलपाकृतियां , शैव ओसर वैष्णव दोनों हैं , जिससे यह मंदिर परिसर प्रतिमा विज्ञान और रूपंकर कला एक वास्तविक संग्रहालय बन जाता है ."
indic2012,Localization,स्थानीकरण
indic2012,Varaha Puran (Varaha means Avatar),वाराह पुराण
ted,to their natural conclusion?,उसे उसके सही निष्कर्श तक कैसे ले जायें?
tides,"At the same time , some of the native states undertook construction of railways within their own jurisdiction .","इसी समय , कुछ देशी रियासतों ने अपने अपने क्षेत्रों में रेलवे निर्माण का कार्य प्रारंभ किया ."
ted,in the national statistical agencies,"हमारे पास ये आंकड़े संयुक्त राष्टों, राष्ट्रीय सांख्यिकी"
tides,"Jwalamukhi , Chintpurni , Naina Devi , Vajrshwari and Chamunda Nandikeshwar temples are devoted to the goddess Shakti . to go there in the Navrathris and perform the religious ceremonies for the children in them , is supposed to be very good .","ज़्वालामुखी चितपुरनी , नैना देवी , बज्रेश्वरी तथा चामुंडा नंदीकेश्र के मंदिर में नवरात्रि में भागवती दर्शन करना , जागरा देना , बच्चों मुंडन् तथा यज्ञोपवीत-संस्कार कराना बड़ा श्रेष्ट समझा जाता"
indic2012,"But because of more population in India, here per human income and expenditure rate is only 3,262 American dollar only, which is according to World Bank is on 125th place.",परंतु भारत की अत्यधिक जनसंख्या के कारण प्रतिव्यक्ति आय क्रयशक्ति की दर से मात्र ३२६२ अमेरिकन डॉलर है जो कि विश्व बैंक के अनुसार १२५वें स्थान पर है।
ted,There should be even more schools doing this kind of project.,और अधिक स्कूलों को भी इस तरह के प्रोजैक्ट करने चाहिए।
ted,"but the growth of a human being,",पर मनुष्य का विकास
tides,They played a notable part in 1942 and after and today they are astir as they have never been before .,उसने 1942 में और उसके बाद खास भूमिका अदा की है.वह आज जितनी बेचैन है ; उतनी पहले कभी नहीं
tides,"The state Archaeological Department gets a paltry Rs 10 lakh as annual allocation to look after three of the 27 forts under its purview-Simhagad , Rajgad and Torna .","27 में से तीन किले-सिंहगढे , राजगढे और तोर्णा-राज्य पुरातत्व विभाग की निगरानी में हैं और उनकी देखरेख के लिए उसे साल में महज 10 लख रु ."
tides,You 'll share in their achievements and be there for them when they need you .,आप उनकी उपलब्धियों में भागीदार होंगे और उनकी ज़रूरत के समय उनके पास होंगे |भाष्;
indic2012,after scientific consensus also the causes of the recent warming there is the subject of research,वैज्ञानिक आम सहमति (scientific consensus) होने के बाद भी हाल ही में हुई गर्मी में वृद्धि के विस्तृत कारण (causes of the recent warming) शोध का विषय होते हैं
ted,"He's like, “Huh!”",वोह बोला “हैं”
tides,"The neck is heavy , the ears are flabby , the horns are twisted and pointed .","गर्दन इनकी भारी होती है.कान मांसल , सींग मुड़े हुए और नुकीले होते हैं ."
ted,"she could not prostitute,","वह वेश्यावृति नहीं कर सकती थी,"
indic2012,Florida,फ्लोरिडा
indic2012,Parthiyo was free from the influence after the fall of the perso,पार्थियनों के पतन के बाद यह फारसी प्रभाव से मुक्त हुआ ।
indic2012,Emission of nitrogen oxide dropped from 27 million tonnes to 19 million tonnes.,नाइट्रोजन ऑक्साइड उत्सर्जन २७ लाख टन से गिरकर १९ मिलियन टन हो गयामिलियन टन हो गया
indic2012,"Main buildings in this fort were Moti Masjid, Diwan-e-aam, Jahangir mahal, Khas Mahal, Sheesh Mahal and Mussamman burj.",इस किले की मुख्य इमारतों में मोती मस्जिद दीवान-ए-आम दीवान-ए-खास जहांगीर मह्ल खास महल शीश महल एवं मुसम्मन बुर्ज आते हैं।
indic2012,Index or catalog of Feed Aggregates,फीड एग्रीगेटर्स की सूची
tides,But it was scarcely likely to appeal to Indian sentiments .,लेकिन इससे भारतीय जनता की भावनाओं के ब्रिटेन के अनुकूल हो जाने की संभावना लगभग नहीं थी .
indic2012,Later this boy was called Kabir.,बाद में यही बालक कबीर कहलाया।
tides,"I see no way of ending the poverty , the vast unemployment , the degradation and the subjection of the Indian people except through socialism .","मुझे हिंदुस्तान की गरीबी , व्यापक बेरोजगारी , भुखमरी और इस मुल्क की गुलामी को दूर करने के लिए समाजवाद के सिवा कोई दूसरा उपाय नजर नहीं आता है ."
indic2012,"2. According to decision of Supreme Court in act 324[1], the power of election commission is not controlled by ministry. It's powers only controlled by election policies which is made by parliament. Inspection, direction and organization of election in country for free and dispassionate way. Where, some parliament processes are silent about election, there election commission keeps power for conducting dispassionate election. But, natural justice, government policies and good use of power through it.",2.सुप्रीम कोर्ट के निर्णयानुसार अनु 324[1] मे निर्वाचन आयोग की शक्तियाँ कार्यपालिका द्वारा नियंत्रित नहीं हो सकती उसकी शक्तियां केवल उन निर्वाचन संबंधी संवैधानिक उपायों तथा संसद निर्मित निर्वाचन विधि से नियंत्रित होती है निर्वाचन का पर्यवेक्षण निर्देशन नियंत्रण तथा आयोजन करवाने की शक्ति मे देश मे मुक्त तथा निष्पक्ष चुनाव आयोजित करवाना भी निहित है जहां कही संसद विधि निर्वाचन के संबंध मे मौन है वहां निष्पक्ष चुनाव करवाने के लिये निर्वाचन आयोग असीमित शक्ति रखता है यधपि प्राकृतिक न्याय विधि का शासन तथा उसके द्वारा शक्ति का सदुपयोग होना चाहिए
indic2012,This is interesting to know here that Wales is not pro-Islam but anti-Islam and his books are published in the opposition of Islam.,यहाँ यह जानना रूचिकर होगा कि वेल्स इस्लाम प्रेमी नहीं ‎बल्कि इस्लाम विरोधी है और उसकी पुस्तकें इस्लाम विरोध में प्रकाशित हुई ‎हैं।
tides,"” Make preparation , you are the harbinger of the voice thereby breaking the shackles of slavery .","” तैयार हो जाओ , तुम गुलामी की जंजीरे तोड़ने वाली आवाज के अग्रदूत हो ."
tides,The former is a larger yellow and reddish species and the latter is mostly honey-yellow and somewhat smaller .,जबकि पॉ . हेब्रीयस अधिकतर शहद जैसी पीली और अपेक्षाकृत छोटी जाति है .
tides,"There are , however , few plants exclusively manufacturing special steel .","फिर भी , विशेष इस्पात के निर्माण के कुछ ही विशेष संयंत्र हैं ."
indic2012,"HTML (hyper text markup language), the standard language used in the world wide web for documents.",संचिका; HTML (हाइपर टेक्स्ट मार्कअप लेंग्वेज) वर्ल्ड वाइड वेब पर डाक्यूमेंट के लिये प्रयोग होने वाली मानक मार्कअप भाषा|
indic2012,Till the onset of the 13th century,१३ वी शताब्दी तक
tides,The electoral qualifications prescribed varied widely and were based on communal affiliation and residence and property credentials .,"निर्वाचन के लिए विहित अर्हताओं में बहुत भिन्नता थी और वे सांप्रदायिक समूह , निवास और संपत्ति पर आधारित थीं ."
indic2012,"It is approximation that they(Homo erectus or Peking men) lived here 3,00,000 to 5,00,000 years agone in past, and some researches have given the important knowledge that “”Peking Men“” knew the art to “”set a fire“” and to control it as well.",अनुमान है कि ये इस क्षेत्र में ३००००० से ५००००० वर्ष पूर्व यहाँ रहते थे और कुछ शोधों से ये महत्वपूर्ण जानकारी भी मिली है की पेकिंग मानव आग जलाने की और उसे नियंत्रित करने की कला जानते थे।
tides,"From the start , the time you spend reading with your children will make books and stories come alive .","शुऋ से ही , आप जो समय अपने बच्चों के साथ पढऋने में बिताएंगे उससे किताबों और कहानियों में जान आ जाएगी ."
ted,It more felt to be the case to me,मुझे यह लगता रहता था कि
ted,let's stop fighting for a moment and start talking.,"हमें लडना छोड कर, बातचीत शुरु करनी होगी।"
tides,No information was forthcoming from private owners regarding the order of their investment .,निजी स्वामियों से उनके निवेश की कोई सूचना नहीं थी .
tides,The House may be dissolved before the expiration of its full term under certain circumstances .,कुछ परिस्थितियों में लोक सभा की पूर्ण अवधि समाप्त होने से पूर्व ही उसका विघटन किया जा सकता है .
ted,The women told us one thing. “Get us technology.,"एक औरत ने हम से कहा, “हमें तकनीकों की ज़रूरत है।"
indic2012,At that time only in 1950 China took possession of Tibet because of which India had to support Nepal to avert the increasing military activities.,उसी समय चीन ने १९५० में तिब्बत पर कब्जा कर लिया जिसकी वजहसे बढ़ती हुई सैनिक गतिविधियों को टालने के लिए भारत नेपाल की स्थायित्व पर चाख बनाने लगा ।
tides,They belong to the first half of the eighth century and contain some fine sculptures .,वे आठवीं शताब्दी के प्रथमार्ध के हैं और उनमें कुछ उत्कृष्ट मूर्तियां हैं .
tides,The result also is that it is easier for Indians to study India 's culture and civilisation in some American university than in India .,शायद इसी का नतीजा यह भी है कि भारतीयों के लिए किसी अमेरिकी विश्वविद्यालय में भारतीय संस्कृति और सयता का अध्ययन करना ज्यादा आसान है .
indic2012,In addition its has control over several places which include Oceania.,इसके अतिरिक्त इसके अन्य भी बहुत से अधिनस्थ क्षेत्र हैं जो ओशिनिया और अन्य स्थानों पर भी फैले हैं।
ted,and this is a really fundamental component of how cells work.,और ये तो कोशिकाऒं के काम काज का बुनियादी भाग है.
tides,"The Council of State was to be a permament body not subject to dissolution , but one-third of its members were to retire every third year .",कौंसिल आफ स्टेट एक स्थायी निकाय होगा जिसे भंग नहीं किया जा सकेगा परंतु उसके एक-तिहाई सदस्य हर तीसरे वर्ष सेवानिवृत्त हो जाएंगे .
tides,Someone is really determined to make the message as bloody as possible : this is jehad and you are as vulnerable as ever .,किसी ने अपनी इस बात को ज्यादा से ज्यादा र>रंऋत तरीके से कहने की आन ली है कि यह जेहाद है और तुम सब पहले की तरह ही निशाने पर हो .
tides,At the moment though every anti-Americanist is not reading Clancy or watching Arnie .,"वैसे , अमेरिकीपन का हर विरोधी ऐसा नहीं कर रहा है ."
ted,It follows the design of bone.,यह हड्डी के डिजाइन की तरह है.
ted,that the negative can be delinked.,नकारात्मक सोच को हटाया जा सके।
tides,One point is clear : there is no “ one-size-fits-all ” approach to managing TMJ .,लेकिन एक बात स्पष्ट हैः टी.एम.जे को संभालने में सबके लिए केवल एक ही तरीका नहीं अपनाया जा सकता .
tides,Andaman and Nicobar islands were the forward air bases of Japan which posed a direct threat to Ceylon and India .,अंडमान व निकोबार द्वीप समूह जापान के अग्रिम हवाई हमलों के अड्डे थे जो भारत व श्रीलंका के लिए बहुत खतरनाक थे .
tides,"Among the hundreds of Hoysala temples of greater or lesser merit , the most well known and typical are the Hoysalesvara among the many temples at Halebid , the Chennakesvara temple at Belur -LRB- both in Hassan district ; the two towns were the earlier and later capitals of the Hoysalas -RRB- , and the Kesava temple at Somnathpur -LRB- Mysore district -RRB- .","न्यूनाधिक महत्व के सैकड़ों होयसल मंदिर हैं ; इनमें से हलेबिड के स्थित अनेक मंदिरों में होयसलेश्वर एवं बेलूर स्थित चन्नकेशव मंदिर दोनों हासन जिले में हैं , ( दोनों शहर होयसलों की पूर्ववर्ती और परवर्ती राजधानी थे ) और सोमनाथ पुर ( मैसूर जिले में ) स्थित केशव मंदिर सर्वाधिक ज्ञात और विशिष्ट हैं ."
ted,and soldiers were pervasive in our society.,और सैनिक समाज में हर तरफ फैले हुए थे
ted,And what's interesting about this view,क्या इस दृश्य के बारे में दिलचस्प है
ted,(Laughter),(ठहाके)
indic2012,Category: Bharat Bharati,श्रेणी:भारत भारती
ted,"Men are restless,","आदमी उछ्छंखल होते हैं,"
ted,"a fairly silly arithmetic game,","एक साधारण सा गणित का खेल है,"
ted,The aggregate numbers are overwhelming.,कुल संख्या काफी भारी है
ted,Here's the key question.,यही मुख्य सवाल है।
indic2012,He continued his studies also,उनका अध्ययन भी जारी रहा ।
indic2012,The beautiful Tajmahal is reflected in the pond which is on the elevated area situated in the centre of the garden.,बाग के मध्य में एक उच्चतल पर बने तालाब में ताजमहल का प्रतिबिम्ब दृश्य होता है।
ted,we can actually use tissue-engineering techniques,हम वास्तव में ऊतक इंजीनियरिंग तकनीक का उपयोग कर सकते हैं
tides,"The udder is well-developed , inclined to be pushed forward from behind with good-sized teats .",हवाना सुविकसित होता है और बड़े थनों के कारण पीछे से कुछ आगे की ओर हलका होता है .
indic2012,City - Dhanbad,धनबाद
tides,The constituent assembly accomplished the tremendous task of framing the constitution in less than three years .,संविधान सभा ने संविधान बनाने का भारी काम तीन वर्ष से कम समय में पूरा किया .
tides,"It is these myriads of proteins that form the solid core of living substances , hence the name which is derived from the Greek word proteios meaning ' holding first place ' in life processes .",इन्हें प्रोटीन कहते हैं.इन अगणित प्रोटीनों से ही जीवित पदार्थों का ठोस अंतर्भाग बनता है.इसलिए ग्रीक शब्द ' प्रटिअस ' 3 से बने इस शब्द का अर्थ है जीवन प्रक्रिया में ' सर्वोच्च स्थान पर आसीन ' पदार्थ .
tides,"Out of 23 Indian men ranked on the ATP computer , only one , Leander Paes , is ranked in the top 200 .",एटीपी कंप्यूटर में दर्जा प्राप्त 23 भारतीयों में से केवल एक लिएंड़र पेस की गिनती चोटी के 200 खिलड़ियों में होती है .
tides,"But the difficulties in the way of modernisation were many : lack of funds , particularly foreign exchange ; nonavailability of machinery ; opposition from labour arising out of a fear of retrenchment .","लेकिन आधुनिकीकरण करने में भी अनेक बाधाएं थीं जैसे पूंजी की कमी , विशेषकर विदेशी मुद्रा की , मशीनों का अभाव , छंटनी के डर से श्रमिकों की ओर से विरोध आदि ."
ted,I must say that before I went to the U.S. I didn't,मैं यहाँ ये कहना कहूंगी कि अमेरिका जाने के पहले मैं खुद को
tides,You said that you wanted us to continue reducing waiting times .,आपने कहा था कि आपको प्रतीक्षा कम करनी पडे|भाष्;
indic2012,"this festival of victory of lightness over darkness spreads the message of triumphant, brotherhood and love.",अंधकार पर प्रकाश की विजय का यह पर्व समाज में उल्लास भाई-चारे व प्रेम का संदेश फैलाता है।
tides,Terms that define what you get and how much you pay are not covered unless they are unclear .,"जब तक कि वे अस्पष्ट न हों , वह ऐसी शर्तों पर लागू नहीं होता है जो यह बयान करतीं हैं कि आपको क्या मिलेगा और आप क्या अदा करेंगे ."
tides,The composition and character of the foreign trade was unbalanced .,विदेशी व्यापार की बनावट और उसकी प्रकृति में असंतुलन था .
indic2012,Cinema,चलचित्र
