source,english_sentence,hindi_sentence
indic2012,a batsmen can leave the field without getting out.if he gets an injury then he can leave as retired hirt.he will be replaced by the next batsmen.he is registered as retired hurt or retired ill. retired batsmen is a not out and he can come again later.,एक बल्लेबाज बिना आउट हुए भी मैदान को छोड़ सकता है.अगर उसे चोट लग जाए या वह घायल हो जाए तो वह अस्थायी रूप से जा सकता है उसे अगले बल्लेबाज के द्वारा प्रतिस्थापित कर दिया जाता है.इसे रिटायर्ड हर्ट (retired hurt) या रिटायर्ड बीमार (retired ill)के रूप में दर्ज किया जाता है.रिटायर्ड बल्लेबाज नॉट आउट होता है और बाद में फ़िर से आ सकता है.एक अछूता बल्लेबाज रिटायर हो सकता है उसे रिटायर आउट (retired out)कहा जाता है; जिसका श्रेय किसी भी खिलाड़ी को नहीं जाता है.बल्लेबाज नो बॉलपर बोल्ड केच लेग बिफोर विकेट स्टंप्डया हिट विकेट आउट हो सकता है. वो वाइड बॉलपर बोल्ड केच लेग बिफोर विकेट या बॉल को दो बार हिट करने पर आउट हो सकता है. इनमें से कुछ प्रकार के आउट गेंदबाज के द्वारा बिना गेंद डाले ही हो सकते हैं. नॉन-स्ट्राइकर बल्लेबाज भी रन आउट (run out by the bowler)हो सकता है यदि वह गेंदबाज के द्वारा गेंद डालने से पहले क्रीज को छोड़ दे और एक बल्लेबाज क्षेत्ररक्षण बाधित करने पर या रिटायर आउट होने पर किसी भी समय आउट हो सकता है.समय समाप्त बिना डिलीवरी के होने वाली बर्खास्तगी है.आउट होने के किसी भी तरीके में केवल एक ही बल्लेबाज एक गेंद पर आउट हो सकता है.
indic2012,"before that, in the year 1930, poet Muhammad Iqbal had suggested two different countries.",सर्वप्रथम सन् 1930 में कवि (शायर) मुहम्मद इक़बाल ने द्विराष्ट्र सिद्धांत का ज़िक्र किया था ।
tides,Know what is normal for you,यह जानिए कि आपके लिए प्राकृतिक क्या है
tides,HEC is now undertaking a programme of product diversification .,एच.ई.सी . अब अपने उत्पादों में वैविध्यकरण का कार्य हाथ में ले रहा है .
tides,"The first of these objectives demands that all boys and girls , without distinction of class or caste should be educated under a system of free and compulsory primary education and all talented children should have an equal opportunity for higher education .",इनमें से प्रथम उद्देश्य यह मांग करता है कि सभी लड़के और लड़कियां Zबिना किसी वर्ग या जाति भेद के नि : शुल्क और अनिवार्य प्राथमिक शिक्षा व्यवस्था के अंतर्गत शिक्षित किये जायें तथा सभी कुशाग्र बुद्धि के बच्चों को बराबरी से उच्च शिक्षा का अवसर दिया जाये .
ted,"but which you can get around,","लेकिन जिन्हें आप समझ सकते है ,"
tides,The Government announced in the 2002 Budget that 5 million per annum would be made available to fund transport solutions for jobseekers in the 63 areas covered by Action Teams for Jobs .,सरकार ने 2002 के बजट में घोषणा की है कि हर वर्ष 5 मिलियन ऐक्शन टीम के 63 इलाकों में नौकरियाँ ढुँढने के ढंग सीखने में मदद देने के लिए खास निजी ट्रांस्पोर्ट की व्यवस्था करने की घोषणा भी की
tides,"Veerappan has released his famous hostage and melted back into the jungles whence he came , and since public memory is short we will quickly forget the ugliness of the Indian state that this shameful episode brought so painfully into focus .","अब वीरप्पन अपने मशंर बंधक को रिहा कर एक बार फिर उसी जंगल में लपता हो गया है जहां से वह उभरा था , और चूंकि लगों की याददाश्त कमजोर होती है , हम जळ ही भारतीय प्रशासन व्यवस्था के उस कुरूप पहलू को भूल जाएंगे जो इस शर्मनाक प्रकरण की वजह से जाहिर हा था ."
indic2012,the energy which is taken from it used in many ways,सौर ऊर्जा जो रोशनी व उष्मा दोनों रूपों में प्राप्त होती है का उपयोग कई प्रकार से हो सकता है।
indic2012,After the huge success of Sholey Bacchan had established himself as strong actor and from 1979to1985 he bagged many filmfare awards and a lot of glory,बॉक्स ऑफिस पर शोले जैसी फिल्मों की जबरदस्त सफलता के बाद बच्चन ने अब तक अपनी स्थिति को मजबूत कर लिया था और १९७६ से १९८४ तक उन्हें अनेक सर्वश्रेष्ठ कलाकार वाले फ़िल्मफ़ेयर पुरस्कार और अन्य पुरस्कार एवं ख्याति मिली।
ted,He said I was throwing my life away,उसने कहा कि मैं अपना जीवन व्यर्थ कर रहा हूँ
ted,(Laughter),(हंसी)
ted,who were the original hackers.,जो की वास्तविक हैकर थे .
tides,They considered it absurd to wait for the unravelling of these mechanisms and give up attempts to alter heredity of plants and animals by more empirical down-to-earch approaches to its control by environmental factors .,इन कार्यविधियों की जानकारी प्राप्त हो जाने तक अपना काम प्रारंभ न करने को एक मूर्खता भरा कदम कहते.उन्होंने इसलिए पौधों तथा प्राणियों में आनुवंशिक परिवर्तन लाने हेतु परिवेश के करकों की सहायता लेने के प्रयास जारी रखना उचित समझा .
indic2012,"30. The economy of the city was dependent on hand crafts, clothes, metal utensils and some other industries.",30. शहर की अर्थव्यस्था हथकरघा वस्त्रों और कुछ धातु आधारित उद्योगों को शामिल करते हुए कई उद्योगों पर निर्भर करती है।
ted,up to 80 percent.,८० प्रतिशत तक.
ted,is how you actually define poverty. What does it mean?,गरीबी की सही परिभाषा आखिर क्या है? गरीबी का अर्थ क्या है?
tides,There may be slight inconvenience in some women .,कई औरतों को चाहे थोडी सी तकलीफ हो
tides,He also knows that he works for a government that has brought the economic reform process to a grinding halt but he still talks of miracles and a 7 per cent growth .,वित्त मंत्री जानते हैं कि वे खुद उस सरकार में काम कर रहे हैं जिसने आर्थिक सुधारों की प्रक्रिया रोक दी है.फिर भी वे करिश्मे और 7 फीसदी विकास दर की बात करते हैं .
ted,and do something with it to change the world.,और इस दुनिया को बेहतर बनाने के लिये कुछ करेंगे ।
tides,"If the logic of the policy of fostering competition is to be pursued , it is inevitable and , in fact , desirable that large , efficient units should emerge and thrive .","यदि प्रतिस्पर्धा जमाने की नीति की तार्किकता का अनुसरण करना ही है , तो यह अनिवार्य और वास्तव में ठीक भी है कि बड़ी और कुशल इकाइयों को विकसित किया और बढ़ावा दिया जाना चाहिए ."
tides,Swimmer Nisha Millet stopped using the lift to her 10th floor apartment to put in some extra endurance work after mind-numbing laps in the pool .,तैराक निशा मिलेट ने स्पर्धा के लिए कुछ ज्यादा दमखम जुटाने की खातिर अपनी 10वीं मंजिल के लौट में फंचने के लिए लिट की सवारी छोड़े दी .
indic2012,"For oblation, hoarse was necessary which was stolen by jealous Indra.",यज्ञ के लिये घोड़ा आवश्यक था जो ईर्ष्यालु इंद्र ने चुरा लिया था।
tides,The place should be always kept properly drained .,"बकरी को जहां रखा जाये , उस स्थान से जल निकास की भी सदा ठीक व्यवस्था होनी चाहिए ."
tides,"In India , especially among Muslims , men and women lived in separate worlds .","भारत में , विशेषकर मुसलमानों में , पुरूषों और महिलाओं की दुनिया अलग- अलग थी ."
ted,"the lake people, in [unclear] operations.",ये समझा नहीं सके ।
indic2012,Due to the curse of Guru Parshuram finding himself unable to use divine weapons he gets down to extract the wheel of the chariot.,गुरु परशुराम के शाप के कारण वह अपने को दैवीय अस्त्रों के प्रयोग में भी असमर्थ पाकर रथ के पहिए को निकालने के लिए नीचे उतरता है।
ted,(Laughter),(हँसी)
ted,because otherwise it just looks wrong somehow.,क्युंकि अन्यथा यह किसी तरह से गलत लगता है |
tides,"The airlines fleet shrunk to just 23 , before two planes were inducted this year .",इस साल दो विमान शामिल करने के पहले इसके बेड़ै में बस 23 विमान बचे थे .
indic2012,This can be heard when one is deep in meditation.,ध्यान मे गहरे उतरने पर यह सुनाई देता है।
ted,But Rosey Grier also had,लेकिन रोजी ग्रीयर का
tides,It is not clear how many companies have violated their agreements .,"वैसे , यह स्पष्ट नहीं है कि कितनी कंपनियां अपने वादे से पीछे हटीं ."
tides,He knew that his end was near and he wanted it .,वह जानता था कि उसका अन्त समय आ गया है वह मरना चाहता भी था .
indic2012,Veda is the name of ancient holy books of Hindu religion.,वेद हिन्दू धर्म के प्राचीन पवित्र ग्रंथों का नाम है ।
tides,But it is the state 's responsibility to find her killers .,"हां , उनके हत्यारों का पता लगाना जरूर उसकी जिमेदारी है ."
tides,Another challenge is the political pressure being exerted for waiving the user charges .,एक और चुनौती राहदारी शुल्क कम करने के लिए राजनैतिक दबाव के रूप में है .
indic2012,Halahal (1946),हलाहल (1946)
tides,"There was a devotee called Mahadevi Shetty , a merchant , in Kalinga -LRB- modern Orissa -RRB- .",महादेवी शेटटी नामक कलिंग ( आधुनिक ओडिसा ) का व्यापारी भी एक भक़्त था .
indic2012,Barabanki District,बाराबांकी जिला
indic2012,"Thus, the real executive power cabinet them the Prime Minister as its head with the brain",इस प्रकार वास्तविक कार्यकारी शक्ति मंत्रिपरिषद् में निहित है जिसका प्रमुख प्रधानमंत्री है।
ted,and describe the world as it unfolds.,दुनिया का वर्णन कर रहे हैं.
ted,of all of the grid cells in a particular part of the brain,ग्रिड कोशिकाओं की कुल क्रिया मस्तिस्क के एक खास हिस्से पर
indic2012,Approval of the Consolidated Fund to withdraw money,6. संचित निधि मे धन निकालने की स्वीकृति लेना
indic2012,C1 Part 249- The Rajya Sabha (ruling party)can pass this rule (Emergency) and declare it to be of national benefit(two out of every three people should be in support of it)but this can be done only till a period of one year.,क1 अनु 249-राज्य सभा यह प्रस्ताव पारित कर दे कि राष्ट्र हित हेतु यह आवश्यक है [2\3 बहुमत से] किंतु यह बन्धन मात्र 1 वर्ष हेतु लागू होता है
tides,"When this has been done , the Bill is ready to be brought before the House .",इस समूची प्रक्रिया के पश्चात विधेयक सदन के समक्ष लाए जाने के लिए तैयार हो जात है .
ted,after only a year become measurably less clogged.,केवल एक साल के बाद ही कम अवरोधित हो जाती हैं ।
tides,The yava or barleyi shaped drums were also barrel drums and they may have been similar to the present day mridanga .,यव अथवा जौ के आकार के वाद्य भी ढोल होते थे और आज के मृदंग जैसे थे .
ted,"More abstract. These are your engineers,","अधिक अमूर्त. ये अपने इंजिनियर रहे हैं,"
ted,but they think that one is the input to the other.,पर वे समझते है कि सरकार का सीधा ताल्लुक राजनीति से है |
indic2012,Vallabhacharya propogated and spread Pushtimarg.,वल्लभाचार्य ने पुष्टिमार्ग का प्रचार-प्रसार किया।
indic2012,Devotee poet,भक्त कवि
tides,The entire evidence against him remained unquestioned and it was on the basis of the untested evidence that the Judge Advocate General secured the conviction .,"सारे सबूत उनके खिलाफ थे , जिन पर किसी ने कोई सवाल नहीं उठाया और इन अनजांचे सबूतों के आधार पर एडवोकेट जनरल ने अपनी राय बनायी ."
tides,"Gentlemen , come to your views .","महोदयगण , अपने विचार प्रकट कीजिए ."
indic2012,"Article 266 describes this as the accumulation of the proceeds of the taxes and levies of the Indian Government, and repaid debts. This is a fund under the custody of the legislature. Expenditure made from this fund is audited by the Controller and Auditor General. Article 266 also describes the global funds of the states also.",- अनु 266 इसका वर्णन भी करता है वह धन जिसे भारत सरकार कर एकत्रीकरण प्राप्त आय उगाहे गये ऋण के अलावा एकत्र करे भारत की लोकनिधि कहलाती है कर्मचारी भविष्य निधि को भारत की लोकनिधि मे जमा किया गया है यह कार्यपालिका के अधीन निधि है इससे व्यय धन महालेखानियंत्रक द्वारा जाँचा जाता है अनु 266 राज्यॉ की लोकनिधि का भी वर्णन करता है
tides,"The basic feature of the People 's Plan , which was essentially Roy 's plan , was its emphasis on agriculture and social services and its self-financing character .","जन-योजना , जो राय की ही योजना थी , मौलिक विशेषता थी , इसका खेती व समाज सेवाओं पर जोर तथा अर्थिक स्वालंबन ."
tides,Finding datable objects poses a challenge for NIOT .,अब तिथि दर्शाने वाली वस्तुएं खोज निकालना एनाऐओटी के लिए एक चुनौती है .
indic2012,Firozabad District,फिरोजाबाद जिला
tides,I got tired of it and went back to Baroda and studied for one year . I then returned to Bengal convinced that a purely political propaganda would not do for the country and that people must be trained spiritually to face dangers .,वहां एक साल तक पढ़ने के बाद मैं इस बात को स्वीकार करके वापिस बंगाल आया कि विशुद्ध राजनीतिक प्रचार देश के लिए अपर्याप्त है और खतरों का सामना करने के लिए लोगों को मानसिक रूप से तैयार करना जरूरी है .
tides,Does not parental care among them acquire an emotional tone at some level ?,क़्या उनमें पैतृक-रक्षण किसी स्तर पर संवेगात्मक रंग नहीं अपनाता ?
ted,we have an election.,हम चुनाव करते हैं।
indic2012,"Used the abstract type, specially pilers, minar, gates, mosque and some surface of mausoleum.",अमूर्त प्रारूप प्रयुक्त किए गए हैं खासकर आधार मीनारों द्वार मस्जिद जवाब में; और कुछ-कुछ मकबरे की सतह पर भी।
tides,"Badminton No . 1 Pullela Gopichand is 2001 ' s true sporting hero , the athlete whom no one knew and the badminton player everyone underestimated .","बैड़मिंटन चैंपियन पुलेल गोपीचंद 2001 के खेल जगत के सच्चे नायक हैं , जिन्हें पहले कोई नहीं जानता था और जिन्हें हर किसी ने कमतर आंका था ."
tides,"What is more , it is also found in the Siva cave-temple at Virasikhamani in the far southern Tirunelveli district and in the cave-temple at Kaviyur , near Quilon in Kerala .","यही नहीं , दूर दक्षिणी जिले तिरूनलवेली में वीर शिखामणि स्थित शिव गुफा मंदिर और केरल में क़्विलन के निकट कवियुर स्थित गुफा मंदिर में भी यह मूर्ति मिलती है ."
ted,One-sixth of the GDP in India is coming out of Mumbai.,भारत में सकल घरेलू उत्पाद का छठा भाग मुंबई से आ रहा है
indic2012,in six different classes there are task force terriorist in this class,छह श्रेणियों में इस टास्क फोर्स में वर्गीकृत आतंकवाद. है
ted,"Tipper was saying, “One more burger, with fries!”","टिप्पर कह रही थी, “ एक और बर्गर , फ्राइस के साथ !”"
ted,Urban retrofitting:,शहरी रेट्रो-फिट: यानि पुराने में नया फिट करना:
indic2012,Here one would be intrested in knowing that Wales was not Islam lover but anti Islamic and his books were published on anti islamic,यहाँ यह जानना रूचिकर होगा कि वेल्स इस्लाम प्रेमी नहीं ‎बल्कि इस्लाम विरोधी है और उसकी पुस्तकें इस्लाम विरोध में प्रकाशित हुई ‎हैं।
indic2012,"Highest runs in one-day international cricket matches (over 14,000 runs).",एकदिवसीय अंतरराष्ट्रीय मुक़ाबले में सबसे ज्यादा रन (१७००० से अधिक)
indic2012,Bhopal,भोपाल
indic2012,According to Soorsaravali his age was 67.,सूरदास की आयु सूरसारावली के अनुसार उस समय ६७ वर्ष थी।
ted,"it's got photons and it's got neutrinos,","उसमें फोटोन और न्युट्रिनो हैं,"
indic2012,Again they refined the illiterate people in the desert so that it may remain years to come.,केवल यही नहीं ‎उसने रेगिस्तान के अनपढ़ लोगों को ऐसा सभ्य बना दिया कि पूरे विश्व पर ‎इस सभ्यता की छाप से सैकड़ों वर्षों बाद भी इसके चिह्न मिलते हैं ।
ted,"they might look like black dots to us,","यह हमें काली बिंदी की तरह दिखती हैं,"
indic2012,"Then a large open space, where long north - south road crosses",इसके बाद एक बडा़ खुला स्थान है जहाँ यह लम्बी उत्तर-दक्षिण सड़क को काटती है।
